{
  "document_id": "document_slide_example001",
  "header": {
    "content_hash": "225e89cc40d4e245cbea7a938df7d74f03b7a8515efbbf00ec4fdb2b30dbc985",
    "contract_id": "profile_presentation_odunnpjgfd76extrtz5pceeuu2",
    "created_at": "2026-06-20T07:10:14.039191Z",
    "extensions": {},
    "producer": "vysi.document_source",
    "producer_version": "0.4.0",
    "revision": 1,
    "schema_id": "document_source.profile_presentation",
    "schema_version": "2.2.0",
    "status": "ok",
    "supersedes": null
  },
  "profile_kind": "presentation",
  "profile_version": "2.0.0",
  "shapes": [],
  "slides": [
    {
      "hidden": false,
      "layout_ref": null,
      "master_ref": null,
      "notes_ref": null,
      "ordinal": 0,
      "slide_id": "slide_example001",
      "source_address": "ppt/slides/slide1.xml"
    }
  ],
  "timing_model": {
    "animations": [],
    "state": "not_present",
    "transitions": []
  }
}
